,Consumerism,"Drinking, Drugs & Smoking",Educational Value,Language,MPAA_rating,Positive Messages,Sex,Sexy Stuff,Violence,Violence & Scariness,age,genre,movie_id,one_line_description,overall_rating,slug,title,is_educational,has_Sexy_Stuff,has_Violence_&_Scariness
14,0.0,0.0,0.0,0.0,NR,3.0,0.0,0.0,0.0,0.0,6,Family and Kids,14,Predictable body-switching comedy has positive messages.,3,the-swap,The Swap,1.0,1.0,1.0
17,1.0,2.0,2.0,2.0,PG,4.0,0.0,1.0,0.0,3.0,8,Family and Kids,17,"Terrific, action-packed superhero sequel was worth the wait.",4,incredibles-2,Incredibles 2,1.0,1.0,1.0
24,1.0,0.0,0.0,0.0,G,5.0,0.0,0.0,0.0,1.0,8,Family and Kids,24,Kid-friendly soccer tale scores with positive messages.,4,alex-me,Alex &amp; Me,1.0,1.0,1.0
29,0.0,0.0,4.0,0.0,NR,4.0,0.0,0.0,0.0,0.0,3,Family and Kids,29,"Biodiversity, environmental concerns in marine adventures.",4,one-big-ocean,One Big Ocean,1.0,1.0,1.0
32,1.0,0.0,1.0,1.0,PG,3.0,0.0,2.0,0.0,3.0,6,Family and Kids,32,"More peril, action in sweet but unsurprising sequel.",3,sherlock-gnomes,Sherlock Gnomes,1.0,1.0,1.0
49,0.0,1.0,1.0,2.0,NR,2.0,0.0,0.0,0.0,2.0,8,Family and Kids,49,"Feisty girl solves a mystery; mild action, kids in peril.",2,kid-west,Kid West,1.0,1.0,1.0
56,1.0,0.0,0.0,1.0,PG,1.0,0.0,0.0,0.0,2.0,8,Family and Kids,56,"Talking animals, slapstick jeopardy in live-action misfire.",1,paws-pi,Paws P.I.,1.0,1.0,1.0
64,0.0,0.0,2.0,2.0,PG,4.0,0.0,1.0,0.0,3.0,6,Family and Kids,64,"Charming prehistoric tribute to ""sacred game"" of soccer.",4,early-man,Early Man,1.0,1.0,1.0
70,2.0,0.0,0.0,0.0,G,1.0,0.0,0.0,0.0,2.0,8,Family and Kids,70,Live-action tale about high school besties has peril.,2,daphne-velma,Daphne &amp; Velma,1.0,1.0,1.0
73,4.0,1.0,2.0,2.0,PG,2.0,0.0,1.0,0.0,3.0,8,Family and Kids,73,Talking-animal buddy comedy dogged by controversy.,2,show-dogs,Show Dogs,1.0,1.0,1.0
74,0.0,0.0,,0.0,PG,4.0,0.0,0.0,0.0,1.0,8,Documentary,74,Fond docu has some images of real-world suffering.,3,pope-francis-a-man-of-his-word,Pope Francis: A Man of His Word,0.0,1.0,1.0
85,3.0,0.0,0.0,0.0,NR,3.0,0.0,0.0,0.0,3.0,7,Family and Kids,85,"Loads of cartoon action, girls' heroics, and toy marketing.",3,lego-dc-superhero-girls-super-villain-high,Lego DC SuperHero Girls: Super-Villain High,1.0,1.0,1.0
90,0.0,0.0,2.0,1.0,PG,3.0,0.0,1.0,0.0,3.0,8,Family and Kids,90,Imaginative animated mermaid adventure has a few scares.,3,lu-over-the-wall,Lu Over the Wall,1.0,1.0,1.0
101,0.0,0.0,1.0,0.0,G,2.0,0.0,0.0,0.0,2.0,6,Family and Kids,201,Slapstick action and humor in musical talking-dog sequel.,3,pup-star-world-tour,Pup Star: World Tour,1.0,1.0,1.0
111,0.0,0.0,,0.0,PG,4.0,0.0,0.0,0.0,3.0,8,Family and Kids,211,"Magical, intense adventure should delight tween Potter fans.",4,mary-and-the-witchs-flower,Mary and the Witch's Flower,0.0,1.0,1.0
117,0.0,0.0,0.0,2.0,PG,2.0,0.0,0.0,0.0,3.0,6,Family and Kids,217,"So-so adventure finds the positive in ""negative"" traits.",2,the-son-of-bigfoot,The Son of Bigfoot,1.0,1.0,1.0
118,1.0,2.0,1.0,1.0,PG,2.0,0.0,3.0,0.0,3.0,7,Family and Kids,218,"Action-heavy take on classic books has peril, edgy jokes.",2,peter-rabbit,Peter Rabbit,1.0,1.0,1.0
120,3.0,0.0,1.0,0.0,NR,4.0,0.0,0.0,0.0,2.0,4,Family and Kids,220,Delightful tale will inspire and engage; mild suspense.,4,maya-the-bee-2-the-honey-games,Maya the Bee 2: The Honey Games,1.0,1.0,1.0
132,1.0,0.0,1.0,0.0,PG,4.0,0.0,1.0,0.0,3.0,6,Family and Kids,232,"Charming, heartfelt sequel entertains, inspires compassion.",4,paddington-2,Paddington 2,1.0,1.0,1.0
140,0.0,0.0,2.0,0.0,NR,4.0,0.0,0.0,0.0,1.0,8,Family and Kids,240,Teens challenge stereotypes in lively Disney musical.,3,zombies,Zombies,1.0,1.0,1.0
141,3.0,0.0,0.0,1.0,NR,2.0,0.0,0.0,0.0,3.0,8,Action/Adventure,241,"Cartoon violence, peril in continuing anime story.",2,digimon-adventure-tri-loss,Digimon Adventure Tri: Loss,1.0,1.0,1.0
154,0.0,1.0,2.0,2.0,PG,3.0,0.0,2.0,0.0,3.0,8,Family and Kids,256,Occasionally amusing animal adventure has mixed messages.,2,sheep-wolves,Sheep &amp; Wolves,1.0,1.0,1.0
159,0.0,2.0,3.0,1.0,PG,4.0,0.0,1.0,0.0,3.0,8,Family and Kids,261,Interesting tale of plucky WWI dog has some war violence.,3,sgt-stubby-an-american-hero,Sgt. Stubby: An American Hero,1.0,1.0,1.0
173,0.0,0.0,0.0,1.0,PG,3.0,0.0,0.0,0.0,3.0,7,Family and Kids,275,"Reimagining of classic tale has lots of peril, some scares.",3,pinocchio-2018,Pinocchio (2018),1.0,1.0,1.0
180,0.0,0.0,,0.0,PG,4.0,0.0,1.0,0.0,1.0,8,Drama,282,"Tragic loss rocks, then inspires team in true sports story.",3,the-miracle-season,The Miracle Season,0.0,1.0,1.0
184,0.0,0.0,4.0,0.0,G,4.0,0.0,0.0,0.0,2.0,6,Documentary,286,Educational doc about scientists training pandas to go wild.,4,pandas,Pandas,1.0,1.0,1.0
194,0.0,1.0,4.0,3.0,NR,5.0,0.0,2.0,0.0,2.0,8,Documentary,296,"Engaging Goodall docu has a little violence, language.",4,jane,Jane,1.0,1.0,1.0
214,0.0,0.0,4.0,0.0,NR,3.0,0.0,0.0,0.0,2.0,6,Documentary,316,"Another beautiful, fascinating penguin docu; some peril.",4,march-of-the-penguins-2-the-next-step,March of the Penguins 2: The Next Step,1.0,1.0,1.0
222,2.0,0.0,5.0,0.0,NR,5.0,0.0,1.0,0.0,3.0,6,Documentary,324,Nature triumphs over devices in inspiring nature docu.,4,backyard-wilderness,Backyard Wilderness,1.0,1.0,1.0
231,0.0,0.0,1.0,0.0,NR,4.0,0.0,0.0,0.0,0.0,7,Family and Kids,333,"Christmas comes to Hope Valley in wholesome, feel-good tale.",3,when-calls-the-heart-the-heart-of-homecoming,When Calls the Heart: The  Heart of Homecoming,1.0,1.0,1.0
232,0.0,0.0,0.0,0.0,PG,0.0,0.0,0.0,0.0,1.0,5,Family and Kids,334,Low-budget talking-dog movie has slapstick humor.,1,a-doggone-adventure,A Doggone Adventure,1.0,1.0,1.0
236,1.0,0.0,0.0,1.0,NR,3.0,0.0,0.0,0.0,3.0,8,Family and Kids,338,Updated dog tale has realistic peril and violence.,3,benji-2018,Benji (2018),1.0,1.0,1.0
237,3.0,0.0,1.0,0.0,NR,3.0,0.0,0.0,0.0,2.0,7,Family and Kids,339,"Part movie, part toy ad; fun, busy, and lots of action.",3,lego-dc-comics-superheroes-the-flash,Lego DC Comics Superheroes: The Flash,1.0,1.0,1.0
238,0.0,0.0,0.0,1.0,PG,3.0,0.0,0.0,0.0,2.0,7,Family and Kids,340,Live-action tale with comic jeopardy and potty humor.,2,monsters-at-large,Monsters at Large,1.0,1.0,1.0
247,1.0,0.0,2.0,2.0,PG,4.0,0.0,1.0,0.0,3.0,6,Family and Kids,349,"Sweet story about compassion, nonviolence has a few scares.",4,ferdinand,Ferdinand,1.0,1.0,1.0
251,0.0,0.0,2.0,1.0,PG,2.0,0.0,0.0,0.0,2.0,8,Family and Kids,353,Cartoonish violence in live-action book-based alien tale.,2,aliens-ate-my-homework,Aliens Ate My Homework,1.0,1.0,1.0
254,0.0,2.0,,1.0,PG,4.0,0.0,0.0,0.0,1.0,8,Family and Kids,356,Heartfelt take on idea for Charles Dickens holiday classic.,4,the-man-who-invented-christmas,The Man Who Invented Christmas,0.0,1.0,1.0
265,1.0,3.0,3.0,1.0,PG,4.0,0.0,1.0,0.0,3.0,7,Family and Kids,368,"Stunningly animated, poignant tribute to family and culture.",4,coco,Coco,1.0,1.0,1.0
284,0.0,0.0,0.0,1.0,NR,4.0,0.0,0.0,0.0,2.0,7,Family and Kids,387,Long-awaited sequel sends Arnold on quest to find parents.,4,hey-arnold-the-jungle-movie,Hey Arnold!: The Jungle Movie,1.0,1.0,1.0
290,0.0,1.0,0.0,1.0,PG,2.0,0.0,0.0,0.0,3.0,7,Family and Kids,393,"Awful live-action/animation has cartoon mayhem, potty humor.",1,woody-woodpecker,Woody Woodpecker,1.0,1.0,1.0
291,1.0,0.0,0.0,0.0,G,3.0,0.0,0.0,0.0,3.0,7,Family and Kids,394,Adorable stray dog in '70s classic; some peril.,3,benji,Benji,1.0,1.0,1.0
292,0.0,0.0,1.0,0.0,PG,4.0,0.0,0.0,0.0,2.0,5,Family and Kids,395,Sweet Nativity story told from animals' perspective.,3,the-star,The Star,1.0,1.0,1.0
317,0.0,0.0,0.0,2.0,PG,1.0,0.0,0.0,0.0,1.0,7,Family and Kids,420,Inept talking-animal tale relies on potty humor.,1,a-dog-and-pony-show,A Dog and Pony Show,1.0,1.0,1.0
324,0.0,0.0,3.0,0.0,G,4.0,0.0,0.0,0.0,2.0,6,Documentary,427,Some animal peril in beautifully filmed nature documentary.,3,earth-one-amazing-day,Earth: One Amazing Day,1.0,1.0,1.0
335,3.0,0.0,2.0,1.0,NR,3.0,0.0,0.0,0.0,2.0,5,Family and Kids,438,More adventures of Kion and his Guard; cartoon peril.,4,the-lion-guard-the-rise-of-scar,The Lion Guard: The Rise of Scar,1.0,1.0,1.0
344,2.0,0.0,2.0,0.0,PG,4.0,0.0,1.0,0.0,2.0,5,Family and Kids,447,"Positive messages, some scary stuff in sweet, sparkly romp.",3,my-little-pony-the-movie-2017,My Little Pony: The Movie (2017),1.0,1.0,1.0
366,5.0,0.0,1.0,1.0,PG,3.0,0.0,0.0,0.0,2.0,6,Family and Kids,469,Plenty of fake kung fu in fun comedy with toy ninjas.,4,the-lego-ninjago-movie,The Lego Ninjago Movie,1.0,1.0,1.0
372,0.0,0.0,1.0,1.0,PG,4.0,0.0,1.0,0.0,3.0,6,Family and Kids,475,Animal comedy has positive messages but weak story.,2,hedgehogs,Hedgehogs,1.0,1.0,1.0
377,0.0,1.0,,1.0,PG,4.0,0.0,1.0,0.0,2.0,8,Drama,480,Faith-based drama has pro-refugee message.,3,all-saints,All Saints,0.0,1.0,1.0
383,3.0,0.0,0.0,0.0,NR,3.0,0.0,0.0,0.0,2.0,8,Action/Adventure,486,Fans of this anime series will enjoy; some violence.,3,digimon-adventure-tri-confession,Digimon Adventure tri: Confession,1.0,1.0,1.0
384,2.0,1.0,2.0,1.0,PG,3.0,0.0,1.0,0.0,3.0,7,Family and Kids,487,"""Threequel"" has more action, strong sibling relationships.",3,despicable-me-3,Despicable Me 3,1.0,1.0,1.0
406,1.0,1.0,,0.0,NR,4.0,0.0,0.0,0.0,1.0,6,Family and Kids,509,Holiday-themed show will give Trolls fans the warm fuzzies.,4,trolls-holiday,Trolls Holiday,0.0,1.0,1.0
409,3.0,0.0,3.0,0.0,NR,4.0,0.0,0.0,0.0,1.0,4,Family and Kids,512,"Positive messages; more suspense, action than past tales.",4,bob-the-builder-mega-machines-the-movie,Bob the Builder: Mega Machines - The Movie,1.0,1.0,1.0
422,2.0,0.0,0.0,0.0,G,3.0,0.0,0.0,0.0,0.0,4,Family and Kids,526,"Merry, mischievous holiday tale is fun for families.",4,all-i-want-for-christmas-is-you,All I Want for Christmas Is You,1.0,1.0,1.0
424,0.0,0.0,,0.0,NR,3.0,0.0,0.0,0.0,2.0,8,Documentary,528,"Deep thoughts, fuzzy cats in heartwarming documentary.",4,kedi,Kedi,0.0,1.0,1.0
429,0.0,0.0,0.0,0.0,NR,4.0,0.0,0.0,0.0,1.0,5,Family and Kids,533,Spunky tree's adventures are filled with festive messages.,4,albert,Albert,1.0,1.0,1.0
432,2.0,1.0,1.0,2.0,PG,3.0,0.0,1.0,0.0,3.0,6,Family and Kids,536,Animated comedy is forgettable but promotes teamwork.,2,the-nut-job-2-nutty-by-nature,The Nut Job 2: Nutty by Nature,1.0,1.0,1.0
437,0.0,0.0,,0.0,NR,3.0,0.0,0.0,0.0,1.0,7,Drama,541,Canadian girl travels to Iran in animated dramedy.,3,window-horses-the-poetic-persian-epiphany-of-rosie-ming,Window Horses: The Poetic Persian Epiphany of Rosie Ming,0.0,1.0,1.0
438,3.0,1.0,2.0,1.0,G,4.0,0.0,0.0,0.0,3.0,6,Family and Kids,542,"Some intense scenes in story of empowerment, mentorship.",4,cars-3,Cars 3,1.0,1.0,1.0
446,0.0,0.0,0.0,0.0,NR,4.0,0.0,1.0,0.0,0.0,7,Family and Kids,550,"Friendship, family, and role models in coming-of-age tale.",4,anne-of-green-gables-the-good-stars,Anne of Green Gables: The Good Stars,1.0,1.0,1.0
454,0.0,0.0,0.0,1.0,NR,3.0,0.0,0.0,0.0,3.0,7,Fantasy,558,"Low-budget, live-action fantasy; kids in peril throughout.",2,a-fairys-game,A Fairy's Game,1.0,1.0,1.0
455,0.0,1.0,0.0,1.0,PG,2.0,0.0,0.0,0.0,2.0,6,Family and Kids,559,Singing-and-talking-dog tale has some peril.,2,pup-star-better-2gether,Pup Star: Better 2gether,1.0,1.0,1.0
461,4.0,1.0,1.0,2.0,PG,4.0,0.0,1.0,0.0,2.0,6,Family and Kids,565,"Positive messages, but colorful adventure is mostly ""meh.""",3,the-emoji-movie,The Emoji Movie,1.0,1.0,1.0
471,5.0,0.0,0.0,0.0,NR,1.0,0.0,0.0,0.0,1.0,4,Family and Kids,575,Full-length commercial for toys; cute but routine story.,2,shopkins-world-vacation,Shopkins: World Vacation,1.0,1.0,1.0
472,3.0,0.0,0.0,0.0,NR,3.0,0.0,0.0,0.0,2.0,5,Family and Kids,576,Barbie and her sisters save dolphins in gentle story.,3,barbie-dolphin-magic,Barbie Dolphin Magic,1.0,1.0,1.0
474,3.0,0.0,0.0,1.0,PG,2.0,0.0,0.0,0.0,2.0,8,Action/Adventure,578,Clever animated throwback to '60s Batman has some violence.,4,batman-vs-two-face,Batman vs. Two-Face,1.0,1.0,1.0
485,0.0,0.0,0.0,0.0,NR,3.0,0.0,0.0,0.0,0.0,4,Family and Kids,589,Kindness saves unfriendly street in fun holiday story.,4,once-upon-a-sesame-street-christmas,Once Upon a Sesame Street Christmas,1.0,1.0,1.0
494,0.0,0.0,1.0,2.0,PG,2.0,0.0,2.0,0.0,4.0,8,Family and Kids,598,"Rude jokes, surprising violence in animated undersea tale.",2,deep,Deep,1.0,1.0,1.0
509,0.0,0.0,0.0,0.0,G,4.0,0.0,0.0,0.0,1.0,4,Family and Kids,613,Delightful musical tale of pumpkin who doesn't fit in.,4,spookley-the-square-pumpkin,Spookley the Square Pumpkin,1.0,1.0,1.0
517,0.0,0.0,2.0,1.0,PG,3.0,0.0,2.0,0.0,3.0,8,Family and Kids,621,Original animated fantasy has a few frightening elements.,3,mune-guardian-of-the-moon,Mune: Guardian of the Moon,1.0,1.0,1.0
523,0.0,0.0,,0.0,PG,3.0,0.0,0.0,0.0,0.0,7,Family and Kids,627,Family-friendly tale of newly inducted witch is so-so.,3,a-witches-ball,A Witches' Ball,0.0,1.0,1.0
527,2.0,0.0,,3.0,PG,3.0,0.0,0.0,0.0,3.0,8,Science Fiction,631,"Suspenseful, thoughtful alien-encounter classic.",5,close-encounters-of-the-third-kind,Close Encounters of the Third Kind,0.0,1.0,1.0
536,0.0,0.0,4.0,0.0,G,4.0,0.0,0.0,0.0,2.0,6,Documentary,640,Absorbing docu about snow leopards has mild peril.,4,ghost-of-the-mountains,Ghost of the Mountains,1.0,1.0,1.0
537,0.0,0.0,0.0,0.0,NR,1.0,0.0,0.0,0.0,1.0,8,Family and Kids,641,"Predictable ""Sleepless in Seattle"" wannabe for tweens.",2,cupids-proxy,Cupid's Proxy,1.0,1.0,1.0
539,0.0,0.0,0.0,0.0,NR,2.0,0.0,0.0,0.0,4.0,8,Action/Adventure,643,Quirky adventure has lots of scares and cartoon violence.,2,monster-island,Monster Island,1.0,1.0,1.0
540,1.0,0.0,1.0,2.0,PG,3.0,0.0,1.0,0.0,3.0,6,Family and Kids,644,Book-based adventure is fun ... if you like potty humor.,3,captain-underpants-the-first-epic-movie,Captain Underpants: The First Epic Movie,1.0,1.0,1.0
552,0.0,0.0,0.0,0.0,NR,2.0,0.0,0.0,0.0,3.0,7,Family and Kids,656,English-dubbed version of animated Chinese tale is confusing,2,the-guardian-brothers,The Guardian Brothers,1.0,1.0,1.0
554,0.0,0.0,0.0,0.0,NR,1.0,0.0,0.0,0.0,1.0,5,Family and Kids,658,Talking animals help lost cat; for younger kids only.,1,the-amazing-adventure-of-marchello-the-cat,The Amazing Adventure of Marchello the Cat,1.0,1.0,1.0
575,0.0,0.0,4.0,0.0,G,3.0,0.0,0.0,0.0,3.0,6,Documentary,679,"Nature docu has gorgeous vistas, moments of peril.",4,born-in-china,Born in China,1.0,1.0,1.0
585,3.0,0.0,2.0,0.0,NR,4.0,0.0,0.0,0.0,2.0,4,Family and Kids,689,"Solid messages, but more scares, spookiness than usual.",3,thomas-friends-journey-beyond-sodor,Thomas &amp; Friends: Journey Beyond Sodor,1.0,1.0,1.0
586,0.0,0.0,,1.0,PG,3.0,0.0,1.0,0.0,2.0,8,Family and Kids,690,Mermaid coming-of-age drama is forgettable but mild.,2,scales-mermaids-are-real,Scales: Mermaids Are Real,0.0,1.0,1.0
587,2.0,0.0,0.0,0.0,NR,2.0,0.0,0.0,0.0,2.0,8,Action/Adventure,691,Fine for fans; new viewers may be confused. Some violence.,2,digimon-adventure-tri-determination,Digimon Adventure tri: Determination,1.0,1.0,1.0
588,0.0,0.0,0.0,1.0,PG,1.0,0.0,0.0,0.0,2.0,6,Family and Kids,692,Routine boy-and-dog treasure hunt with fart jokes.,2,treasure-hounds,Treasure Hounds,1.0,1.0,1.0
597,1.0,0.0,0.0,0.0,NR,4.0,0.0,0.0,0.0,1.0,8,Family and Kids,701,"Exceptional sequel promotes communication, female roles.",4,descendants-2,Descendants 2,1.0,1.0,1.0
602,3.0,0.0,0.0,0.0,NR,1.0,0.0,0.0,0.0,3.0,7,Family and Kids,706,"Franchises merge for toy tie-ins; cartoon action, peril.",2,lego-dc-super-hero-girls-brain-drain,Lego DC Super Hero Girls: Brain Drain,1.0,1.0,1.0
605,2.0,0.0,1.0,1.0,PG,3.0,0.0,0.0,0.0,2.0,8,Family and Kids,709,"New cast, but more of the same gross-out humor, hijinks.",2,diary-of-a-wimpy-kid-the-long-haul,Diary of a Wimpy Kid: The Long Haul,1.0,1.0,1.0
616,0.0,0.0,0.0,1.0,PG,2.0,0.0,0.0,0.0,2.0,7,Family and Kids,720,Kid helps cop in tame but awful family comedy.,1,cop-and-a-half-new-recruit,Cop and a Half: New Recruit,1.0,1.0,1.0
628,0.0,0.0,0.0,0.0,NR,2.0,0.0,0.0,0.0,2.0,8,Family and Kids,732,Bland ballet tale has some bullying.,2,you-can-tutu,You Can Tutu,1.0,1.0,1.0
630,3.0,0.0,0.0,1.0,NR,2.0,0.0,0.0,0.0,2.0,6,Family and Kids,734,Lego & Scooby-Doo crew team up for mildly spooky adventure.,2,lego-scooby-doo-blowout-beach-bash,Lego Scooby-Doo! Blowout Beach Bash,1.0,1.0,1.0
632,1.0,2.0,0.0,2.0,PG,3.0,0.0,1.0,0.0,3.0,6,Family and Kids,736,"Animated comedy about sibling rivalry has peril, body humor.",3,the-boss-baby,The Boss Baby,1.0,1.0,1.0
640,3.0,0.0,5.0,0.0,NR,4.0,0.0,0.0,0.0,0.0,8,Documentary,744,Thoughtful docu about space program urges return to cosmos.,4,fight-for-space,Fight for Space,1.0,1.0,1.0
646,0.0,0.0,1.0,2.0,PG,3.0,0.0,1.0,0.0,3.0,6,Family and Kids,750,Sci-fi adventure isn't too scary but has lots of clichés.,2,spark-a-space-tail,Spark: A Space Tail,1.0,1.0,1.0
647,2.0,0.0,1.0,0.0,PG,4.0,0.0,1.0,0.0,3.0,6,Family and Kids,751,"Smurfs adventure has girl-power message, some peril.",3,smurfs-the-lost-village,Smurfs: The Lost Village,1.0,1.0,1.0
649,3.0,0.0,1.0,0.0,NR,2.0,0.0,0.0,0.0,2.0,7,Family and Kids,753,Famous frenemies add cartoon violence to classic tale.,2,tom-and-jerry-willy-wonka-the-chocolate-factory,Tom and Jerry: Willy Wonka &amp; the Chocolate Factory,1.0,1.0,1.0
654,2.0,0.0,0.0,1.0,NR,3.0,0.0,0.0,0.0,1.0,8,Family and Kids,758,Faith-based summer camp tale deals with bullying.,3,camp-cool-kids,Camp Cool Kids,1.0,1.0,1.0
677,0.0,1.0,1.0,2.0,PG,3.0,0.0,1.0,0.0,1.0,8,Comedy,781,"Whimsical, sweet story about friendship, gardening.",3,this-beautiful-fantastic,This Beautiful Fantastic,1.0,1.0,1.0
679,2.0,0.0,3.0,0.0,NR,4.0,0.0,0.0,0.0,2.0,8,Documentary,783,Compelling but slow-paced doc about Iroquois lacrosse team.,3,spirit-game-pride-of-a-nation,Spirit Game: Pride of a Nation,1.0,1.0,1.0
686,4.0,0.0,1.0,1.0,PG,4.0,0.0,1.0,0.0,3.0,7,Family and Kids,790,"Clever, creative, action-packed adventure/toy ad.",4,the-lego-batman-movie,The Lego Batman Movie,1.0,1.0,1.0
689,0.0,0.0,1.0,1.0,G,3.0,0.0,0.0,0.0,3.0,7,Family and Kids,793,"Animated parrot adventure has cartoon action, mild scares.",3,americano,Americano,1.0,1.0,1.0
704,1.0,1.0,2.0,1.0,PG,4.0,0.0,2.0,0.0,3.0,8,Family and Kids,808,"Fantastic but scarier remake of the ""tale as old as time.""",4,beauty-and-the-beast-2017,Beauty and the Beast,1.0,1.0,1.0
716,0.0,0.0,1.0,0.0,PG,3.0,0.0,0.0,0.0,3.0,7,Family and Kids,820,Orphan bird takes wing with wacky flock; heroes in peril.,3,a-storks-journey,A Stork's Journey,1.0,1.0,1.0
727,0.0,0.0,2.0,0.0,PG,2.0,0.0,0.0,0.0,3.0,8,Family and Kids,831,"Forgettable tale with cute kids, gallant dog; some violence.",2,max-2-white-house-hero,Max 2: White House Hero,1.0,1.0,1.0
731,3.0,0.0,0.0,0.0,NR,2.0,0.0,0.0,0.0,3.0,7,Family and Kids,835,Action-packed superhero tale has lots of cartoon violence.,2,dc-super-hero-girls-intergalactic-games,DC Super Hero Girls: Intergalactic Games,1.0,1.0,1.0
732,0.0,0.0,1.0,1.0,PG,4.0,0.0,0.0,0.0,3.0,6,Family and Kids,836,Animated comedy is old-fashioned and fun; some peril.,3,rock-dog,Rock Dog,1.0,1.0,1.0
733,0.0,0.0,2.0,0.0,G,3.0,0.0,1.0,0.0,3.0,5,Family and Kids,837,Disney's original circle-of-life story.,5,bambi,Bambi,1.0,1.0,1.0
742,0.0,0.0,2.0,0.0,NR,5.0,0.0,0.0,0.0,0.0,3,Family and Kids,846,More kid-friendly entertainment from inquisitive tiger cub.,5,daniel-tigers-neighborhood-tiger-family-trip,Daniel Tiger's Neighborhood: Tiger Family Trip,1.0,1.0,1.0
753,3.0,0.0,1.0,0.0,NR,3.0,0.0,0.0,0.0,3.0,7,Family and Kids,857,"Wolf cub tale has much more fighting, suspense than usual.",2,alpha-and-omega-journey-to-bear-kingdom,Alpha and Omega: Journey to Bear Kingdom,1.0,1.0,1.0
760,0.0,0.0,1.0,0.0,PG,4.0,0.0,2.0,0.0,2.0,8,Drama,864,Beautiful word-free drama about castaway who finds love.,4,the-red-turtle,The Red Turtle,1.0,1.0,1.0
780,0.0,0.0,5.0,0.0,NR,4.0,0.0,0.0,0.0,2.0,7,Drama,884,"Inpsiring, educational biopic about a remarkable naturalist.",4,amazon-adventure-3d,Amazon Adventure 3D,1.0,1.0,1.0
792,0.0,0.0,0.0,2.0,NR,0.0,0.0,0.0,0.0,2.0,8,Comedy,896,Dog and kids save mom in poorly made comedy.,1,in-the-doghouse,In the Doghouse,1.0,1.0,1.0
795,2.0,0.0,1.0,1.0,PG,3.0,0.0,1.0,0.0,3.0,7,Family and Kids,899,"Lots of action, thin story in boy-meets-creature adventure.",2,monster-trucks,Monster Trucks,1.0,1.0,1.0
802,1.0,0.0,0.0,0.0,NR,4.0,0.0,0.0,0.0,1.0,5,Family and Kids,906,Enjoyable movie follow-up continues spunky Rapunzel's tale.,4,tangled-before-ever-after,Tangled: Before Ever After,1.0,1.0,1.0
818,0.0,1.0,3.0,0.0,NR,4.0,0.0,0.0,0.0,1.0,7,Family and Kids,922,"Enjoyable, beautiful, warmhearted remake of classic tale.",4,heidi-2015,Heidi (2015),1.0,1.0,1.0
820,0.0,0.0,0.0,0.0,NR,3.0,0.0,1.0,0.0,1.0,8,Comedy,924,Prep schoolers play pranks in high-spirited tween comedy.,3,bruno-and-boots-this-cant-be-happening-at-macdonald-hall,Bruno and Boots: This Can't Be Happening at Macdonald Hall,1.0,1.0,1.0
826,3.0,0.0,0.0,0.0,NR,3.0,0.0,0.0,0.0,2.0,7,Family and Kids,930,"Lots of zaps, bolts, and fun, plus new dolls to buy.",3,monster-high-electrified,Monster High: Electrified,1.0,1.0,1.0
832,2.0,0.0,0.0,0.0,G,3.0,0.0,0.0,0.0,2.0,6,Family and Kids,936,Brave young princess saves the day; some scares.,3,the-swan-princess-royally-undercover,The Swan Princess: Royally Undercover,1.0,1.0,1.0
836,0.0,0.0,1.0,0.0,NR,4.0,0.0,0.0,0.0,0.0,7,Family and Kids,940,"Christmas on the frontier; holiday messages, wholesome tale.",3,when-calls-the-heart-the-heart-of-faith,When Calls the Heart: The Heart of Faith,1.0,1.0,1.0
841,1.0,2.0,1.0,2.0,PG,3.0,0.0,2.0,0.0,3.0,7,Family and Kids,945,"Musical has great songs, slapstick laughs, mixed messages.",3,sing,Sing,1.0,1.0,1.0
844,0.0,0.0,3.0,0.0,NR,3.0,0.0,0.0,0.0,2.0,8,Documentary,948,Family leaves tech behind during winter in the Yukon.,3,all-the-time-in-the-world,All the Time in the World,1.0,1.0,1.0
855,3.0,0.0,0.0,0.0,NR,2.0,0.0,1.0,0.0,3.0,7,Family and Kids,959,The lovable space family gets upstaged by wrestling.,2,the-jetsons-wwe-robo-wrestlemania,The Jetsons &amp; WWE: Robo-Wrestlemania,1.0,1.0,1.0
858,0.0,0.0,0.0,0.0,G,1.0,0.0,0.0,0.0,1.0,7,Family and Kids,962,Poorly made family comedy sequel has mild peril.,2,robo-dog-airborne,Robo-Dog: Airborne,1.0,1.0,1.0
861,0.0,1.0,0.0,1.0,PG,3.0,0.0,1.0,0.0,3.0,8,Family and Kids,965,Fourth movie in Spanish-language series has scary parts.,2,la-leyenda-del-chupacabras,La Leyenda del Chupacabras,1.0,1.0,1.0
870,1.0,0.0,2.0,2.0,PG,4.0,0.0,0.0,0.0,3.0,6,Family and Kids,974,"Great characters, memorable music, some monsters/scares.",4,moana,Moana,1.0,1.0,1.0
871,2.0,0.0,0.0,1.0,NR,3.0,0.0,0.0,0.0,0.0,6,Family and Kids,975,Springtime fun and laughs from friendly prehistoric herd.,4,ice-age-the-great-egg-scapade,Ice Age: The Great Egg-scapade,1.0,1.0,1.0
880,0.0,0.0,5.0,0.0,NR,5.0,0.0,0.0,0.0,0.0,3,Family and Kids,984,"Dino family's fun journey emphasizes curiosity, courage.",4,dinosaur-train-whats-at-the-center-of-the-earth,Dinosaur Train: What's at the Center of the Earth?,1.0,1.0,1.0
884,0.0,0.0,4.0,0.0,PG,3.0,0.0,0.0,0.0,3.0,7,Documentary,988,Beautifully filmed docu tells story of European wildlife.,4,seasons,Seasons,1.0,1.0,1.0
889,0.0,0.0,0.0,0.0,PG,3.0,0.0,0.0,0.0,3.0,8,Family and Kids,993,"Animated mouse adventure with emotional intensity, peril.",3,air-bound,Air Bound,1.0,1.0,1.0
892,1.0,0.0,5.0,0.0,NR,4.0,0.0,0.0,0.0,1.0,7,Documentary,996,STEM-themed docu will inspire kids to become engineers.,4,dream-big-engineering-our-world,Dream Big: Engineering Our World,1.0,1.0,1.0
895,3.0,0.0,0.0,0.0,NR,3.0,0.0,0.0,0.0,2.0,7,Family and Kids,999,Action-packed Wild West adventure has some peril.,3,scooby-doo-shaggys-showdown,Scooby-Doo! Shaggy's Showdown,1.0,1.0,1.0
901,3.0,0.0,2.0,0.0,NR,4.0,0.0,0.0,0.0,0.0,3,Family and Kids,1005,"Trains' sweet origin story promotes friendship, cooperation.",4,thomas-friends-the-adventure-begins,Thomas &amp; Friends: The Adventure Begins,1.0,1.0,1.0
914,1.0,0.0,4.0,0.0,G,5.0,0.0,0.0,0.0,2.0,8,Documentary,1018,Inspiring documentary about barrier-breaking teen girl.,4,the-eagle-huntress,The Eagle Huntress,1.0,1.0,1.0
916,1.0,0.0,2.0,1.0,PG,4.0,0.0,2.0,0.0,3.0,6,Family and Kids,1020,"Fun, colorful adventure has some peril, lots of great music.",4,trolls,Trolls,1.0,1.0,1.0
917,1.0,0.0,1.0,0.0,NR,4.0,0.0,0.0,0.0,1.0,5,Family and Kids,1021,Princess crossover features two strong female role models.,4,elena-and-the-secret-of-avalor,Elena and the Secret of Avalor,1.0,1.0,1.0
925,0.0,0.0,0.0,0.0,PG,0.0,0.0,0.0,0.0,2.0,8,Family and Kids,1029,Dreadful low-budget fantasy is hard to watch.,1,jurassic-school,Jurassic School,1.0,1.0,1.0
928,3.0,0.0,1.0,0.0,NR,3.0,0.0,0.0,0.0,1.0,5,Family and Kids,1032,Barbie's a smart coder in gentle video game adventure.,3,barbie-video-game-hero,Barbie:  Video Game Hero,1.0,1.0,1.0
929,2.0,3.0,,0.0,G,4.0,0.0,1.0,0.0,3.0,6,Family and Kids,1033,Disney masterpiece is darker than you may remember.,5,pinocchio,Pinocchio,0.0,1.0,1.0
932,0.0,0.0,0.0,2.0,PG,2.0,0.0,0.0,0.0,3.0,8,Family and Kids,1036,"Action-packed adventure has peril, violence, name-calling.",2,guardians-of-oz,Guardians of Oz,1.0,1.0,1.0
933,0.0,0.0,3.0,0.0,NR,3.0,0.0,0.0,0.0,0.0,5,Family and Kids,1037,Pint-sized problem-solvers face rival squad on funny show.,4,odd-squad-the-movie,Odd Squad: The Movie,1.0,1.0,1.0
944,0.0,0.0,0.0,1.0,PG,3.0,0.0,0.0,0.0,2.0,7,Family and Kids,1048,Wave-riding sequel features surf action plus WWE folks.,3,surfs-up-2-wave-mania,Surf's Up 2: Wave Mania,1.0,1.0,1.0
946,0.0,2.0,2.0,1.0,PG,4.0,0.0,1.0,0.0,3.0,8,Family and Kids,1050,Thrilling tale about a girl's search for her grandfather.,4,long-way-north,Long Way North,1.0,1.0,1.0
948,0.0,0.0,0.0,0.0,NR,3.0,0.0,0.0,0.0,3.0,5,Family and Kids,1052,Bears save circus animals from villainous owner.,3,boonie-bears-the-big-top-secret,Boonie Bears: The Big Top Secret,1.0,1.0,1.0
949,0.0,0.0,1.0,1.0,PG,3.0,0.0,0.0,0.0,3.0,8,Family and Kids,1053,Legendary logger fights today's developers; some jeopardy.,3,bunyan-and-babe,Bunyan and Babe,1.0,1.0,1.0
950,0.0,0.0,,0.0,G,0.0,0.0,1.0,0.0,1.0,8,Romance,1054,Dreadful musical adventure is nonsensical and dumb.,1,tini-the-new-life-of-violetta,Tini: The New Life of Violetta,0.0,1.0,1.0
