,Consumerism,"Drinking, Drugs & Smoking",Educational Value,Language,MPAA_rating,Positive Messages,Sex,Sexy Stuff,Violence,Violence & Scariness,age,genre,movie_id,one_line_description,overall_rating,slug,title,is_educational,has_Sexy_Stuff,has_Violence_&_Scariness
6068,0.0,0.0,,1.0,PG,2.0,0.0,0.0,0.0,3.0,8,Family and Kids,6193,"Bright, spirited, and edgy version of Willy Wonka.",4,charlie-and-the-chocolate-factory-2005,Charlie and the Chocolate Factory (2005),0.0,1.0,1.0
6071,0.0,1.0,1.0,1.0,NR,3.0,0.0,1.0,0.0,1.0,6,Family and Kids,6196,Sentimental Depression-era Christmas story is fine for kids.,2,12-dogs-of-christmas,12 Dogs of Christmas,1.0,1.0,1.0
6072,2.0,0.0,1.0,0.0,NR,5.0,0.0,0.0,0.0,1.0,4,Family and Kids,6197,Doing good deeds is focus of less overtly religious tale.,4,veggietales-lord-of-the-beans,VeggieTales: Lord of the Beans,1.0,1.0,1.0
6073,0.0,0.0,4.0,0.0,G,5.0,0.0,0.0,0.0,1.0,5,Family and Kids,6198,Powerful tale of former slave with big ideas about freedom.,4,the-journey-of-henry-box-brown,The Journey of Henry Box Brown,1.0,1.0,1.0
6079,3.0,0.0,,0.0,G,0.0,0.0,0.0,0.0,0.0,6,Comedy,6204,Kids may enjoy it; most parents will snooze.,3,herbie-fully-loaded,Herbie: Fully Loaded,0.0,1.0,1.0
6086,2.0,0.0,1.0,0.0,NR,3.0,0.0,0.0,0.0,0.0,3,Family and Kids,6211,"CGI bears teach messages about working hard, caring.",3,the-care-bears-big-wish-movie,The Care Bears Big Wish Movie,1.0,1.0,1.0
6087,0.0,0.0,0.0,1.0,G,3.0,0.0,1.0,0.0,2.0,6,Family and Kids,6212,"More fun, goofy cartoon antics than Disney polish.",4,the-emperors-new-groove,The Emperor's New Groove,1.0,1.0,1.0
6088,0.0,0.0,2.0,0.0,PG,4.0,0.0,1.0,0.0,0.0,8,Documentary,6213,Enchanting dance documentary hits all the right beats.,5,mad-hot-ballroom,Mad Hot Ballroom,1.0,1.0,1.0
6091,0.0,0.0,0.0,0.0,G,3.0,0.0,1.0,0.0,3.0,6,Family and Kids,6216,Kids will be drawn to Disney's fast-paced version.,4,tarzan,Tarzan,1.0,1.0,1.0
6094,0.0,0.0,1.0,1.0,G,1.0,0.0,1.0,0.0,3.0,5,Family and Kids,6219,Zany spoof of reality TV with lots of cartoon action.,2,tom-jerry-the-fast-and-the-furry,Tom &amp; Jerry: The Fast and the Furry,1.0,1.0,1.0
6102,0.0,0.0,,0.0,G,0.0,0.0,0.0,0.0,3.0,8,Family and Kids,6228,Jodie Foster stars in goofy kid mobster movie.,3,bugsy-malone,Bugsy Malone,0.0,1.0,1.0
6104,0.0,0.0,0.0,0.0,NR,3.0,0.0,0.0,0.0,2.0,8,Family and Kids,6230,Early Japanese animation teaches positive lessons on virtue.,4,alakazam-the-great,Alakazam the Great!,1.0,1.0,1.0
6105,0.0,2.0,1.0,1.0,G,4.0,0.0,1.0,0.0,3.0,7,Family and Kids,6231,Kitschy '70s Pippi is kid adventure-fantasy at its best.,4,pippi-longstocking-pippi-in-the-south-seas,Pippi Longstocking: Pippi in the South Seas,1.0,1.0,1.0
6106,0.0,2.0,1.0,0.0,G,4.0,0.0,1.0,0.0,2.0,7,Family and Kids,6232,"Kitschy '70s Pippi adventures still fun, but no pirates.",3,pippi-longstocking-pippi-goes-on-board,Pippi Longstocking: Pippi Goes on Board,1.0,1.0,1.0
6107,0.0,0.0,1.0,1.0,G,4.0,0.0,1.0,0.0,2.0,7,Family and Kids,6233,Kids run away from home with Pippi in kitschy '70s series.,3,pippi-longstocking-pippi-on-the-run,Pippi Longstocking: Pippi on the Run,1.0,1.0,1.0
6114,0.0,0.0,,0.0,NR,3.0,0.0,0.0,0.0,0.0,3,Family and Kids,6240,Cute stories about friendship; fun for preschoolers.,4,scholastic-video-collection-danny-and-the-dinosaur,Scholastic Video Collection: Danny and the Dinosaur,0.0,1.0,1.0
6115,0.0,0.0,,0.0,NR,3.0,0.0,0.0,0.0,0.0,3,Family and Kids,6241,Charming stories of the seasons for preschoolers.,3,scholastic-video-collection-bear-snores-on,Scholastic Video Collection: Bear Snores On,0.0,1.0,1.0
6116,0.0,0.0,0.0,1.0,PG,5.0,0.0,1.0,0.0,2.0,5,Family and Kids,6242,"Endearing ""follow your dreams"" story with plenty of laughs.",4,robots,Robots,1.0,1.0,1.0
6118,1.0,1.0,,2.0,PG,5.0,0.0,0.0,0.0,3.0,6,Family and Kids,6244,Touching robot-kid friendship tale has great messages.,4,the-iron-giant,The Iron Giant,0.0,1.0,1.0
6119,0.0,0.0,,0.0,NR,1.0,0.0,0.0,0.0,2.0,7,Family and Kids,6245,Witty Claymation shorts with whole-family appeal.,5,wallace-gromit-in-three-amazing-adventures,Wallace &amp; Gromit in Three Amazing Adventures,0.0,1.0,1.0
6122,0.0,0.0,,0.0,PG,0.0,0.0,0.0,0.0,3.0,7,Family and Kids,6248,Kids will love the 3-D aspect of this movie.,2,the-adventures-of-sharkboy-and-lavagirl-in-3-d,The Adventures of Sharkboy and Lavagirl in 3-D,0.0,1.0,1.0
6124,1.0,0.0,,1.0,NR,3.0,0.0,1.0,0.0,1.0,8,Family and Kids,6250,Ho-hum Halloween tween film is fine for older kids.,3,halloweentown-high,Halloweentown High,0.0,1.0,1.0
6126,0.0,0.0,1.0,0.0,NR,3.0,0.0,0.0,0.0,2.0,5,Family and Kids,6252,"Heavy-handed Christian tale could provoke questions, fears.",2,the-littlest-angel,The Littlest Angel,1.0,1.0,1.0
6127,0.0,0.0,,0.0,NR,3.0,0.0,0.0,0.0,3.0,7,Fantasy,6254,"Tween brew: Witchy fun, a pinch of fright.",3,halloweentown,Halloweentown,0.0,1.0,1.0
6132,0.0,0.0,,0.0,G,3.0,0.0,0.0,0.0,1.0,3,Family and Kids,6259,Sweet-as-honey Halloween story with Pooh and pals.,3,poohs-heffalump-halloween-movie,Pooh's Heffalump Halloween Movie,0.0,1.0,1.0
6136,0.0,1.0,0.0,1.0,NR,0.0,0.0,0.0,0.0,2.0,5,Family and Kids,6263,"Wowzers, this silly caper is hampered by poor CGI animation.",2,inspector-gadgets-biggest-caper-ever,Inspector Gadget's Biggest Caper Ever,1.0,1.0,1.0
6137,4.0,0.0,2.0,0.0,NR,4.0,0.0,0.0,0.0,0.0,3,Family and Kids,6264,Thomas and friends adventure offers lessons in cooperation.,3,thomas-friends-calling-all-engines,Thomas &amp; Friends: Calling All Engines!,1.0,1.0,1.0
6141,0.0,1.0,0.0,0.0,NR,3.0,0.0,0.0,0.0,1.0,6,Classic,6268,Classic Shirley Temple film promotes positivity.,4,heidi,Heidi,1.0,1.0,1.0
6145,0.0,0.0,,0.0,PG,3.0,0.0,0.0,0.0,0.0,5,Family and Kids,6272,"More of the same, sweet and fun for kids.",4,lilo-and-stitch-2-stitch-has-a-glitch,Lilo and Stitch 2: Stitch Has a Glitch,0.0,1.0,1.0
6147,3.0,0.0,0.0,0.0,G,2.0,0.0,0.0,0.0,1.0,3,Family and Kids,6274,Sweet pony tale teaches the importance of friendship.,3,my-little-pony-friends-are-never-far-away,My Little Pony: Friends Are Never Far Away,1.0,1.0,1.0
6148,0.0,0.0,2.0,0.0,G,4.0,0.0,1.0,0.0,2.0,7,Family and Kids,6275,Tale of 19th-century girl power will inspire modern kids.,4,the-adventures-of-ociee-nash,The Adventures of Ociee Nash,1.0,1.0,1.0
6149,1.0,0.0,0.0,1.0,NR,2.0,0.0,1.0,0.0,1.0,7,Family and Kids,6276,Slapstick kid/dog adventure is nothing to bark home about.,1,lenny-the-wonder-dog,Lenny the Wonder Dog,1.0,1.0,1.0
6151,3.0,0.0,,0.0,PG,3.0,0.0,0.0,0.0,3.0,8,Documentary,6278,Up-close look at an off-road motor race.,4,dust-to-glory,Dust to Glory,0.0,1.0,1.0
6159,0.0,1.0,0.0,1.0,PG,3.0,0.0,1.0,0.0,2.0,7,Family and Kids,6286,Quirky animated comedy follows a family's ups and downs.,3,my-neighbors-the-yamadas,My Neighbors the Yamadas,1.0,1.0,1.0
6164,0.0,0.0,0.0,1.0,G,3.0,0.0,1.0,0.0,1.0,7,Family and Kids,6291,"Farcical, old-fashioned Hans Christian Andersen tale.",2,the-emperors-new-clothes,The Emperor's New Clothes,1.0,1.0,1.0
6165,0.0,1.0,0.0,0.0,G,1.0,0.0,1.0,0.0,2.0,7,Family and Kids,6293,"'80s musical fairy tale is slightly scary, a little slow.",2,rumpelstiltskin,Rumpelstiltskin,1.0,1.0,1.0
6166,0.0,2.0,3.0,3.0,G,3.0,0.0,1.0,0.0,3.0,8,Classic,6294,Musical adaptation doesn't improve the classic tale.,2,huckleberry-finn,Huckleberry Finn,1.0,1.0,1.0
6168,2.0,1.0,3.0,1.0,PG,4.0,0.0,0.0,0.0,1.0,8,Family and Kids,6296,A girl and a dog educate a small southern town.,3,because-of-winn-dixie,Because of Winn-Dixie,1.0,1.0,1.0
6169,0.0,0.0,,0.0,G,0.0,0.0,0.0,0.0,3.0,7,Family and Kids,6297,Raucous Muppet spoof of a classic gets a wee bit edgy.,3,the-muppets-wizard-of-oz,The Muppets' Wizard of Oz,0.0,1.0,1.0
6172,0.0,0.0,1.0,1.0,G,1.0,0.0,0.0,0.0,2.0,6,Family and Kids,6300,Whimsical tale of a circus orphan has a few scary bits.,3,toby-tyler,Toby Tyler,1.0,1.0,1.0
6173,0.0,0.0,0.0,0.0,G,1.0,0.0,0.0,0.0,1.0,5,Family and Kids,6301,Animated musical is good intro to Pippi's adventures.,3,pippi-longstocking,Pippi Longstocking,1.0,1.0,1.0
6184,0.0,0.0,,0.0,G,0.0,0.0,0.0,0.0,0.0,7,Family and Kids,6312,"Sweet, inspiring story tween girls will love.",4,ice-princess,Ice Princess,0.0,1.0,1.0
6194,0.0,1.0,1.0,1.0,NR,3.0,0.0,0.0,0.0,3.0,8,Family and Kids,6322,Funny wish-granting story has some mild scariness.,3,5-children-it,5 Children &amp; It,1.0,1.0,1.0
6195,1.0,0.0,,1.0,NR,4.0,0.0,0.0,0.0,1.0,8,Family and Kids,6323,"Wholesome Hilary Duff movie has simple, positive messages.",3,cadet-kelly,Cadet Kelly,0.0,1.0,1.0
6198,0.0,0.0,,0.0,G,0.0,0.0,0.0,0.0,0.0,8,Family and Kids,6326,Tween-friendly movie based on hit Disney comedy.,3,the-even-stevens-movie,The Even Stevens Movie,0.0,1.0,1.0
6199,0.0,0.0,,0.0,NR,0.0,0.0,0.0,0.0,0.0,3,Family and Kids,6327,"A mixed bag, but mostly delightful.",4,scholastic-video-collection-the-day-jimmys-boa-ate-the-wash,Scholastic Video Collection: The Day Jimmy's Boa Ate the Wash,0.0,1.0,1.0
6200,0.0,0.0,,0.0,NR,3.0,0.0,0.0,0.0,0.0,3,Family and Kids,6328,Charming stories are perfect for family viewing.,4,scholastic-video-collection-tikki-tikki-tembo,Scholastic Video Collection: Tikki Tikki Tembo,0.0,1.0,1.0
6201,1.0,0.0,2.0,0.0,NR,2.0,0.0,0.0,0.0,1.0,4,Family and Kids,6329,Love thy bully is the religious-based lesson here.,3,veggietales-minnesota-cuke-and-the-search-for-samsons-hairbrush,VeggieTales: Minnesota Cuke and the Search for Samson's Hairbrush,1.0,1.0,1.0
6211,0.0,0.0,,0.0,G,2.0,0.0,0.0,0.0,3.0,6,Family and Kids,6339,Sequel offers an enjoyable jungle jaunt with young Tarzan.,4,tarzan-ii,Tarzan II,0.0,1.0,1.0
6227,0.0,0.0,3.0,0.0,NR,5.0,0.0,2.0,0.0,2.0,5,Family and Kids,6355,"Enchanting folk tale with toddler hero, for all ages.",5,kirikou-and-the-sorceress,Kirikou and the Sorceress,1.0,1.0,1.0
6229,0.0,0.0,2.0,0.0,NR,4.0,0.0,0.0,0.0,0.0,4,Family and Kids,6357,Angelina and friends tackle preschool pressures with grace.,4,angelina-ballerina-the-big-performance,Angelina Ballerina: The Big Performance,1.0,1.0,1.0
6230,0.0,0.0,,0.0,NR,0.0,0.0,0.0,0.0,0.0,6,Family and Kids,6358,Eight episodes themed around Mr. Krabby.,4,spongebob-squarepants-fear-of-a-krabby-patty,Spongebob Squarepants: Fear of a Krabby Patty,0.0,1.0,1.0
6233,0.0,0.0,1.0,0.0,G,4.0,0.0,0.0,0.0,2.0,4,Family and Kids,6361,Gentle story of friendship is fine for wee ones.,3,poohs-heffalump-movie,Pooh's Heffalump Movie,1.0,1.0,1.0
6242,1.0,1.0,,2.0,PG,1.0,0.0,1.0,0.0,1.0,7,Family and Kids,6370,Live-action talking-animal movie has lots of potty humor.,3,racing-stripes,Racing Stripes,0.0,1.0,1.0
6251,0.0,0.0,4.0,0.0,G,5.0,0.0,0.0,0.0,1.0,6,Documentary,6379,Breathtaking docu zooms in on insect life in vivid color.,5,microcosmos,Microcosmos,1.0,1.0,1.0
6258,0.0,1.0,1.0,1.0,G,3.0,0.0,0.0,0.0,2.0,7,Family and Kids,6386,Amusing but long romp for both adults and kids.,4,that-darn-cat-1965,That Darn Cat! (1965),1.0,1.0,1.0
6266,4.0,1.0,0.0,2.0,PG,2.0,0.0,0.0,0.0,3.0,7,Science Fiction,6394,"So-bad-it's-good ""E.T."" rip-off; lots of product placement.",2,mac-and-me,Mac and Me,1.0,1.0,1.0
6268,0.0,1.0,3.0,0.0,PG,3.0,0.0,0.0,0.0,2.0,8,Family and Kids,6396,1960s whale adventure has some peril but teaches tolerance.,4,namu-my-best-friend,Namu: My Best Friend,1.0,1.0,1.0
6273,2.0,2.0,1.0,4.0,PG,0.0,0.0,2.0,0.0,3.0,8,Family and Kids,6402,"Beetlejuice wannabe with potty talk, a bit of heart.",3,little-monsters,Little Monsters,1.0,1.0,1.0
6276,0.0,1.0,1.0,1.0,PG,3.0,0.0,1.0,0.0,2.0,8,Family and Kids,6405,"Boarding school comedy with bullying, strong messages.",3,a-feast-at-midnight,A Feast at Midnight,1.0,1.0,1.0
6282,0.0,2.0,0.0,0.0,NR,0.0,0.0,0.0,0.0,1.0,8,Musical,6411,"Patriotic '40s classic charms, but some dated behaviors.",4,yankee-doodle-dandy,Yankee Doodle Dandy,1.0,1.0,1.0
6287,0.0,0.0,0.0,0.0,PG,0.0,0.0,0.0,0.0,0.0,8,Drama,6416,Grisham's family baseball drama has iffy messages.,2,mickey,Mickey,1.0,1.0,1.0
6291,4.0,0.0,1.0,1.0,PG,4.0,0.0,1.0,0.0,1.0,7,Family and Kids,6420,Cosby cartoon comes to life in tween-centered story.,3,fat-albert,Fat Albert,1.0,1.0,1.0
6296,1.0,2.0,2.0,1.0,PG,4.0,0.0,2.0,0.0,3.0,7,Family and Kids,6425,"Top-notch, action-packed fun for the entire family.",5,the-incredibles,The Incredibles,1.0,1.0,1.0
6297,0.0,0.0,,0.0,NR,0.0,0.0,0.0,0.0,0.0,6,Musical,6426,Charming love story plus great song and dance.,5,easter-parade,Easter Parade,0.0,1.0,1.0
6298,0.0,2.0,0.0,0.0,NR,3.0,0.0,0.0,0.0,2.0,8,Romance,6427,"Magical Scottish village, singing, dancing, and romance.",3,brigadoon,Brigadoon,1.0,1.0,1.0
6299,0.0,0.0,,0.0,NR,0.0,0.0,0.0,0.0,0.0,2,Family and Kids,6428,A watch-and-grow-sleepy experience.,5,goodnight-moon-and-other-sleepytime-tales,Goodnight Moon and Other Sleepytime Tales,0.0,1.0,1.0
6301,0.0,0.0,,0.0,G,3.0,0.0,0.0,0.0,0.0,8,Family and Kids,6430,Sports and outdoor adventures mixed with science.,4,popular-mechanics-for-kids-x-treme-sports-and-other-action-adventures,Popular Mechanics for Kids: X-treme Sports and Other Action Adventures,0.0,1.0,1.0
6302,0.0,0.0,,0.0,G,3.0,0.0,0.0,0.0,0.0,8,Family and Kids,6431,Dangerous creatures abound in educational DVD.,4,popular-mechanics-for-kids-gators-and-dragons-and-other-wild-beasts,Popular Mechanics for Kids: Gators and Dragons and Other Wild Beasts,0.0,1.0,1.0
6305,0.0,1.0,,0.0,G,0.0,0.0,0.0,0.0,0.0,5,Family and Kids,6434,A must for family viewing.,5,the-thief-and-the-cobbler,The Thief and the Cobbler,0.0,1.0,1.0
6306,2.0,0.0,,0.0,NR,2.0,0.0,0.0,0.0,3.0,8,Science Fiction,6435,"Frantic, noisy 'toon shorts from Skywalker saga.",3,star-wars-clone-wars,Star Wars: Clone Wars,0.0,1.0,1.0
6310,4.0,3.0,0.0,1.0,PG,0.0,0.0,1.0,0.0,3.0,6,Family and Kids,6439,Very similar to the edgy animated TV show.,3,the-spongebob-squarepants-movie,The SpongeBob SquarePants Movie,1.0,1.0,1.0
6315,0.0,0.0,,0.0,G,3.0,0.0,0.0,0.0,0.0,3,Family and Kids,6444,Stories of magic based on popular kids' books.,4,scholastic-video-collection-sylvester-and-the-magic-pebble,Scholastic Video Collection: Sylvester and the Magic Pebble,0.0,1.0,1.0
6318,5.0,2.0,0.0,1.0,PG,1.0,0.0,0.0,0.0,3.0,8,Family and Kids,6447,Kids will laugh at lame story with lots of cartoon violence.,2,punks,P.U.N.K.S.,1.0,1.0,1.0
6319,0.0,0.0,0.0,0.0,NR,3.0,0.0,0.0,0.0,2.0,4,Family and Kids,6448,'70s Easter classic has very mild scares and peril.,3,here-comes-peter-cottontail,Here Comes Peter Cottontail,1.0,1.0,1.0
6325,0.0,1.0,1.0,2.0,G,2.0,0.0,1.0,0.0,2.0,4,Family and Kids,6454,Message-laden superhero tale is trite and uninspiring.,1,the-adventures-of-the-american-rabbit,The Adventures of the American Rabbit,1.0,1.0,1.0
6326,0.0,0.0,1.0,0.0,NR,2.0,0.0,1.0,0.0,2.0,7,Family and Kids,6455,"""Those meddling kids"" encounter brief alien scares.",3,scooby-doo-and-the-alien-invaders,Scooby-Doo and the Alien Invaders,1.0,1.0,1.0
6327,0.0,0.0,0.0,0.0,NR,1.0,0.0,0.0,0.0,3.0,7,Family and Kids,6456,"Mystery contains familiar elements, some scary moments.",3,scooby-doo-and-the-monster-of-mexico,Scooby-Doo and the Monster of Mexico,1.0,1.0,1.0
6328,2.0,0.0,1.0,1.0,NR,1.0,0.0,1.0,0.0,3.0,6,Family and Kids,6457,Scooby and gang use teamwork to save the day once again.,3,aloha-scooby-doo,"Aloha, Scooby-Doo",1.0,1.0,1.0
6329,0.0,0.0,,0.0,NR,3.0,0.0,0.0,0.0,0.0,6,Family and Kids,6458,Sanitized telling of the legend of John Henry.,4,shelley-duvall-presents-american-tall-tales-and-legends-john-henry,Shelley Duvall Presents: American Tall Tales and Legends: John Henry,0.0,1.0,1.0
6330,1.0,0.0,1.0,0.0,PG,3.0,0.0,1.0,0.0,2.0,8,Family and Kids,6459,"Fast, fresh, funny action comedy set undersea.",4,shark-tale,Shark Tale,1.0,1.0,1.0
6335,0.0,0.0,,0.0,G,4.0,0.0,0.0,0.0,2.0,8,Musical,6464,"Jazzy, family-friendly musical remake of classic film.",4,the-wiz,The Wiz,0.0,1.0,1.0
6336,0.0,0.0,1.0,0.0,G,4.0,0.0,1.0,0.0,2.0,6,Action/Adventure,6465,Exciting dog sled story has some cartoonish violence.,3,balto-3-wings-of-change,Balto 3: Wings of Change,1.0,1.0,1.0
6348,2.0,0.0,,0.0,G,3.0,0.0,1.0,0.0,2.0,5,Family and Kids,6477,"Mediocre sequel has lightweight story; some peril, violence.",2,mulan-ii,Mulan II,0.0,1.0,1.0
6351,0.0,1.0,4.0,0.0,NR,3.0,0.0,0.0,0.0,2.0,5,Family and Kids,6480,Animated classics are surprisingly educational.,4,rikki-tikki-taviyankee-doodle-cricket,Rikki Tikki Tavi/Yankee Doodle Cricket,1.0,1.0,1.0
6353,0.0,0.0,,0.0,PG,0.0,0.0,0.0,0.0,3.0,8,Science Fiction,6482,Lots for both kids and adults to enjoy.,4,sky-captain-and-the-world-of-tomorrow,Sky Captain and the World of Tomorrow,0.0,1.0,1.0
6360,0.0,0.0,1.0,1.0,NR,1.0,0.0,1.0,0.0,2.0,5,Family and Kids,6489,Lots of wacky cartoon violence in outer space comedy.,3,tom-jerry-blast-off-to-mars,Tom &amp; Jerry: Blast Off to Mars,1.0,1.0,1.0
6371,2.0,2.0,0.0,2.0,PG,1.0,0.0,0.0,0.0,2.0,8,Family and Kids,6500,"Potty humor, pratfalls as mischief-makers set sea lion free.",2,slappy-and-the-stinkers,Slappy and the Stinkers,1.0,1.0,1.0
6375,0.0,0.0,,0.0,PG,0.0,0.0,0.0,0.0,3.0,8,Family and Kids,6504,These babies need a time out.,1,super-babies-baby-geniuses-2,Super Babies: Baby Geniuses 2,0.0,1.0,1.0
6376,0.0,0.0,,0.0,G,3.0,0.0,0.0,0.0,0.0,4,Family and Kids,6505,Little kids will enjoy this Easter tale.,3,winnie-the-pooh-springtime-with-roo,Winnie the Pooh: Springtime with Roo,0.0,1.0,1.0
6381,0.0,2.0,2.0,0.0,G,2.0,0.0,0.0,0.0,1.0,6,Fantasy,6510,"Curious but not scary, this Alice is close to the book.",3,alices-adventures-in-wonderland-1972,Alice's Adventures in Wonderland (1972),1.0,1.0,1.0
6389,0.0,0.0,,0.0,PG,0.0,0.0,0.0,0.0,3.0,6,Family and Kids,6518,Charming movie featuring an adorable dog.,3,benji-off-the-leash,Benji Off the Leash,0.0,1.0,1.0
6393,0.0,0.0,,0.0,G,3.0,0.0,0.0,0.0,3.0,7,Family and Kids,6522,Visually stunning 50 minute IMAX thumbs-up.,4,the-young-black-stallion,The Young Black Stallion,0.0,1.0,1.0
6394,0.0,0.0,,0.0,PG,0.0,0.0,0.0,0.0,3.0,8,Family and Kids,6523,"Stunningly beautiful, but too intense for little kids.",4,two-brothers,Two Brothers,0.0,1.0,1.0
6397,0.0,0.0,,0.0,PG,2.0,0.0,0.0,0.0,3.0,8,Action/Adventure,6526,Exciting kid space-action without being too scary.,3,thunderbirds,Thunderbirds,0.0,1.0,1.0
6406,2.0,0.0,0.0,0.0,G,2.0,0.0,1.0,0.0,1.0,8,Family and Kids,6535,A fun romp for girls of all ages.,4,the-princess-diaries-2-royal-engagement,The Princess Diaries 2: Royal Engagement,1.0,1.0,1.0
6408,0.0,2.0,1.0,0.0,G,4.0,0.0,1.0,0.0,0.0,6,Family and Kids,6537,World's coolest nanny celebrates family and fun.,5,mary-poppins,Mary Poppins,1.0,1.0,1.0
6422,0.0,0.0,1.0,2.0,NR,2.0,0.0,0.0,0.0,1.0,6,Family and Kids,6551,"Christmas adventure has some harsh, mean-spirited moments.",2,in-search-of-santa,In Search of Santa,1.0,1.0,1.0
6428,0.0,3.0,,0.0,NR,0.0,0.0,1.0,0.0,2.0,8,Classic,6557,"Jerry Lewis screwball comedy is tedious, lacks kid appeal.",2,the-errand-boy,The Errand Boy,0.0,1.0,1.0
6431,0.0,1.0,,1.0,NR,2.0,0.0,1.0,0.0,2.0,8,Family and Kids,6560,"Goofy animated caper with lots of pratfalls, potty humor.",2,kangaroo-jack-gday-usa,Kangaroo Jack: G'Day USA!,0.0,1.0,1.0
6432,0.0,0.0,,0.0,G,0.0,0.0,0.0,0.0,0.0,3,Family and Kids,6561,Charming stories about canines.,4,scholastic-video-collection-bark-george,"Scholastic Video Collection: Bark, George",0.0,1.0,1.0
6435,3.0,2.0,0.0,1.0,PG,4.0,0.0,1.0,0.0,1.0,7,Family and Kids,6564,Peppy holiday favorite for both kids and parents.,4,elf,Elf,1.0,1.0,1.0
6436,3.0,0.0,1.0,0.0,NR,2.0,0.0,1.0,0.0,1.0,5,Family and Kids,6565,"Collection of unmemorable holiday shorts, but fun extras.",2,mickeys-twice-upon-a-christmas,Mickey's Twice Upon a Christmas,1.0,1.0,1.0
6437,0.0,0.0,0.0,0.0,G,0.0,0.0,0.0,0.0,3.0,8,Family and Kids,6566,So-so adaptation has some scary moments for younger kids.,3,the-nutcracker-prince,The Nutcracker Prince,1.0,1.0,1.0
6438,0.0,0.0,,0.0,NR,3.0,0.0,0.0,0.0,0.0,8,Family and Kids,6567,Behind the scenes look at theme parks and more.,4,popular-mechanics-for-kids-rip-roarin-roller-coasters,Popular Mechanics for Kids: Rip Roarin Roller Coasters,0.0,1.0,1.0
6439,0.0,0.0,,0.0,NR,0.0,0.0,0.0,0.0,0.0,4,Family and Kids,6568,Little yellow car protects London from thieves.,3,brum-snow-thieves-other-stories,Brum: Snow Thieves &amp; Other Stories,0.0,1.0,1.0
6440,1.0,0.0,,0.0,NR,3.0,0.0,0.0,0.0,1.0,4,Family and Kids,6569,"Fair fare, but nothing to sound the horn about.",3,brum-crazy-chair-chase,Brum: Crazy Chair Chase,0.0,1.0,1.0
6446,0.0,0.0,,0.0,PG,1.0,0.0,0.0,0.0,0.0,6,Family and Kids,6575,Just as much fairy tale fun as the first one.,5,shrek-2,Shrek 2,0.0,1.0,1.0
6447,3.0,0.0,0.0,2.0,G,3.0,0.0,0.0,0.0,3.0,7,Family and Kids,6576,"Noisy, subpar cartoon adventure with lots of peril.",1,rainbow-brite-and-the-star-stealer,Rainbow Brite and the Star Stealer,1.0,1.0,1.0
6448,0.0,0.0,0.0,0.0,G,2.0,0.0,1.0,0.0,3.0,6,Musical,6577,Christmas musical retold as cartoon; some scary bits.,3,babes-in-toyland,Babes in Toyland,1.0,1.0,1.0
6451,0.0,0.0,,0.0,PG,0.0,0.0,0.0,0.0,3.0,8,Family and Kids,6580,A lackluster sequel to the well-loved original.,3,the-black-stallion-returns,The Black Stallion Returns,0.0,1.0,1.0
6457,0.0,0.0,,1.0,NR,1.0,0.0,0.0,0.0,1.0,4,Family and Kids,6586,Mild 2003 TV special best for big Peanuts fans.,3,i-want-a-dog-for-christmas-charlie-brown,"I Want a Dog for Christmas, Charlie Brown",0.0,1.0,1.0
6460,0.0,0.0,,0.0,PG,3.0,0.0,0.0,0.0,0.0,6,Documentary,6589,"A big, beautiful love letter to America.",4,americas-heart-and-soul,America's Heart and Soul,0.0,1.0,1.0
6461,3.0,1.0,2.0,0.0,G,4.0,0.0,1.0,0.0,3.0,5,Family and Kids,6590,Disneyfied but dignified tale of Chinese warrior.,4,mulan,Mulan,1.0,1.0,1.0
6462,0.0,1.0,1.0,0.0,PG,3.0,0.0,1.0,0.0,3.0,8,Family and Kids,6591,Animated feature tells story of Moses; some violence.,4,the-prince-of-egypt,The Prince of Egypt,1.0,1.0,1.0
6469,5.0,0.0,0.0,2.0,PG,0.0,0.0,1.0,0.0,2.0,7,Family and Kids,6598,Live-action cat tale has lots of cartoon violence.,2,garfield,Garfield,1.0,1.0,1.0
6470,1.0,0.0,,3.0,PG,3.0,0.0,2.0,0.0,2.0,7,Comedy,6599,Funny and sweet update of the Cinderella tale.,3,a-cinderella-story,A Cinderella Story,0.0,1.0,1.0
6471,0.0,0.0,,0.0,NR,3.0,0.0,0.0,0.0,0.0,6,Family and Kids,6600,"Bizarre humor, high-speed antics, non-stop fun!",5,pee-wees-playhouse-christmas-special,Pee-wee's Playhouse Christmas Special,0.0,1.0,1.0
6472,0.0,3.0,,3.0,PG,3.0,0.0,2.0,0.0,0.0,7,Science Fiction,6601,Kids' sci-fi adventure never fully blasts off.,2,explorers,Explorers,0.0,1.0,1.0
6475,0.0,5.0,,0.0,NR,1.0,0.0,0.0,0.0,1.0,8,Comedy,6604,Jerry Lewis' Jekyll-Hyde spoof is dated but great.,4,the-nutty-professor-1963,The Nutty Professor (1963),0.0,1.0,1.0
6480,0.0,0.0,,0.0,NR,0.0,0.0,0.0,0.0,1.0,6,Musical,6609,Thrillingly energetic dances on film.,5,seven-brides-for-seven-brothers,Seven Brides for Seven Brothers,0.0,1.0,1.0
6481,0.0,0.0,,0.0,NR,0.0,0.0,0.0,0.0,0.0,8,Musical,6611,Unforgettable musical is great for parents and kids alike.,5,an-american-in-paris,An American in Paris,0.0,1.0,1.0
6485,1.0,0.0,2.0,0.0,NR,0.0,0.0,0.0,0.0,1.0,4,Family and Kids,6615,Positive messages about friendship; some mild frights.,3,care-bears-journey-to-joke-a-lot,Care Bears: Journey to Joke-a-Lot,1.0,1.0,1.0
6488,3.0,1.0,0.0,1.0,G,3.0,0.0,2.0,0.0,3.0,6,Family and Kids,6618,A magic carpet ride of a movie from Disney.,5,aladdin,Aladdin,1.0,1.0,1.0
6491,0.0,0.0,,0.0,NR,3.0,0.0,0.0,0.0,3.0,4,Family and Kids,6621,"Dark, creepy story lacks Yuletide spirit.",1,rudolph-and-frostys-christmas-in-july,Rudolph and Frosty's Christmas in July,0.0,1.0,1.0
6493,0.0,0.0,0.0,1.0,PG,2.0,0.0,0.0,0.0,1.0,7,Family and Kids,6623,Tedious talking-dog film has some cartoonish violence.,2,sherlock-undercover-dog,Sherlock: Undercover Dog,1.0,1.0,1.0
6495,1.0,0.0,1.0,0.0,NR,2.0,0.0,1.0,0.0,1.0,5,Family and Kids,6625,Updated fable features romance; a few positive messages.,3,barbie-as-the-princess-and-the-pauper,Barbie as the Princess and the Pauper,1.0,1.0,1.0
6503,0.0,1.0,1.0,0.0,NR,3.0,0.0,0.0,0.0,1.0,6,Comedy,6633,Silly and very English-humored spin on Cinderella story.,4,prince-cinders,Prince Cinders,1.0,1.0,1.0
6505,0.0,1.0,0.0,2.0,PG,4.0,0.0,1.0,0.0,3.0,7,Science Fiction,6635,Sci-fi action classic perfect for sharing with kids.,4,star-wars-episode-iv-a-new-hope,Star Wars: Episode IV: A New Hope,1.0,1.0,1.0
6508,0.0,0.0,3.0,0.0,G,4.0,0.0,0.0,0.0,0.0,5,Family and Kids,6638,Respectful Magoo treatment of Dickens is fun for kids.,3,mr-magoos-christmas-carol,Mr. Magoo's Christmas Carol,1.0,1.0,1.0
6509,0.0,0.0,,0.0,G,2.0,0.0,1.0,0.0,1.0,7,Family and Kids,6639,Olsen twins compete for scholarships in predictable tale.,2,the-challenge,The Challenge,0.0,1.0,1.0
6511,0.0,0.0,,0.0,PG,0.0,0.0,0.0,0.0,0.0,6,Family and Kids,6641,"Not a classic, but cute and fun for families.",4,home-on-the-range,Home on the Range,0.0,1.0,1.0
6514,2.0,0.0,,1.0,PG,1.0,0.0,1.0,0.0,3.0,7,Family and Kids,6644,"Milder than the 1st, but not Scooby-snack worthy.",2,scooby-doo-2-monsters-unleashed,Scooby-Doo 2: Monsters Unleashed,0.0,1.0,1.0
6517,0.0,0.0,0.0,0.0,PG,3.0,0.0,1.0,0.0,3.0,8,Science Fiction,6647,Ewok-filled finale less Force-ful than previous.,4,star-wars-episode-vi-the-return-of-the-jedi,Star Wars: Episode VI: The Return of the Jedi,1.0,1.0,1.0
6522,0.0,0.0,2.0,1.0,NR,4.0,0.0,1.0,0.0,1.0,8,Drama,6652,"Lovely, kid-friendly sequel has more romance than the first.",4,anne-of-green-gables-the-sequel,Anne of Green Gables: The Sequel,1.0,1.0,1.0
6526,0.0,0.0,,0.0,NR,3.0,0.0,0.0,0.0,0.0,4,Family and Kids,6656,When you need a break from Elmo and Barney.,3,brum-soccer-hero-and-other-stories,Brum: Soccer Hero and Other Stories,0.0,1.0,1.0
6535,0.0,1.0,0.0,0.0,PG,2.0,0.0,0.0,0.0,3.0,8,Action/Adventure,6665,"Low-budget family adventure has peril, mild scares.",1,the-lost-treasure-of-sawtooth-island,The Lost Treasure of Sawtooth Island,1.0,1.0,1.0
6541,1.0,1.0,1.0,0.0,G,3.0,0.0,0.0,0.0,1.0,6,Family and Kids,6671,Non-musical sequel a fun adventure for young kids.,3,annie-a-royal-adventure,Annie:  A Royal Adventure!,1.0,1.0,1.0
6544,0.0,0.0,,0.0,G,3.0,0.0,0.0,0.0,3.0,5,Family and Kids,6674,Romeo and Juliet in the pridelands.,3,the-lion-king-2-simbas-pride,The Lion King 2: Simba's Pride,0.0,1.0,1.0
6546,1.0,0.0,1.0,0.0,G,1.0,0.0,0.0,0.0,0.0,4,Family and Kids,6676,Charming and harmless. Nap while your kid enjoys.,3,cliffords-really-big-movie,Clifford's Really Big Movie,1.0,1.0,1.0
